{
  "spec_version": "0.3",
  "codebook_id": "imol-skill-v0.3",
  "embedding_dim": 256,
  "codewords": [
    {
      "id": "syntax.module_layout",
      "spec_version": "0.3",
      "tags": [
        "syntax",
        "module"
      ],
      "keywords": [
        "module",
        "layout",
        "structure",
        "file",
        "begin"
      ],
      "expansion": "IMOL modules start with `module <name>` optional same-line `@id(\"...\")`. Then optional workshop, imports, plans, tools, types, functions. Workshop must appear before imports when present.",
      "tool_policy": [],
      "examples_ref": [
        "examples/hello.imol"
      ],
      "embedding": [
        -0.151959627866745,
        0,
        0,
        0,
        0,
        0,
        0,
        0,
        0,
        0,
        0,
        0,
        -0.27859261631965637,
        0,
        0,
        0,
        0,
        0,
        0,
        0,
        0,
        0,
        0,
        0,
        0,
        0.30391925573349,
        0,
        0,
        0,
        0,
        0,
        0,
        -0.16462291777133942,
        0,
        0,
        0,
        0,
        0,
        0,
        0,
        -0.13929630815982819,
        0,
        0,
        0,
        0,
        0,
        0,
        0,
        0,
        0,
        0,
        0,
        0,
        0,
        0,
        0,
        0,
        0,
        0,
        0,
        0,
        0,
        -0.11396971344947815,
        0,
        0,
        0,
        0,
        0.12663301825523376,
        0,
        0,
        0,
        0,
        0,
        0,
        0,
        0,
        0,
        0,
        0,
        0,
        0,
        0,
        0,
        0,
        0,
        0,
        0,
        0,
        0,
        0,
        0,
        0,
        -0.12663301825523376,
        0,
        0,
        0,
        0,
        0,
        0,
        0,
        0,
        0,
        -0.13929630815982819,
        0,
        0,
        0.08864311128854752,
        0,
        0,
        0,
        0,
        0,
        0,
        0,
        0,
        0,
        0,
        0,
        0,
        -0.12663301825523376,
        0,
        0,
        0,
        0,
        0,
        0,
        0,
        -0.13929630815982819,
        0,
        0,
        0,
        0,
        0,
        0,
        0,
        0,
        0,
        0,
        0,
        0,
        0,
        0,
        0,
        0,
        0,
        -0.151959627866745,
        0,
        -0.11396971344947815,
        0,
        0,
        0,
        0,
        0,
        0,
        0,
        -0.12663301825523376,
        0,
        0,
        0.49386873841285706,
        0,
        0,
        0,
        0,
        0,
        0.08864311128854752,
        -0.11396971344947815,
        0,
        0,
        0,
        0,
        0,
        -0.12663301825523376,
        0,
        0,
        0,
        0,
        0,
        0,
        0,
        0,
        0.13929630815982819,
        0,
        0,
        0,
        0,
        0,
        0,
        0,
        0,
        0,
        0,
        0,
        0,
        0,
        0,
        0,
        0,
        0,
        0,
        -0.13929630815982819,
        0,
        0,
        0,
        0,
        0,
        0,
        0,
        0,
        0,
        0,
        0,
        -0.12663301825523376,
        0,
        0,
        0,
        0,
        0,
        0,
        0,
        0,
        0,
        0,
        0,
        0,
        0.16462291777133942,
        0,
        0,
        0,
        0,
        0,
        0.30391925573349,
        -0.11396971344947815,
        0,
        0,
        0,
        0,
        0,
        0,
        0,
        0,
        0,
        0,
        0.16462291777133942,
        0,
        0,
        0,
        0,
        0,
        0,
        0,
        0.30391925573349,
        0,
        0,
        0,
        0,
        0,
        0.11396971344947815
      ]
    },
    {
      "id": "syntax.import",
      "spec_version": "0.3",
      "tags": [
        "syntax",
        "import"
      ],
      "keywords": [
        "import",
        "alias",
        "tools.fs",
        "std.io"
      ],
      "expansion": "Use `import path.dotted as alias`. Resolved to `path/dotted.imol` under project root.",
      "tool_policy": [],
      "examples_ref": [
        "examples/entry_with_tools.imol"
      ],
      "embedding": [
        0,
        0,
        0,
        0,
        0,
        0.14415381848812103,
        0,
        0,
        0,
        0,
        0,
        0,
        0,
        0,
        0,
        0,
        0,
        0,
        0,
        0,
        0,
        0,
        0,
        0,
        -0.14415381848812103,
        0,
        0,
        0,
        0,
        0,
        0,
        0,
        0,
        0,
        0,
        0,
        -0.20593403279781342,
        0,
        0,
        0,
        0,
        0,
        0,
        0,
        0,
        0,
        0,
        0,
        0,
        0,
        0,
        0,
        0,
        0,
        0,
        0,
        0,
        0,
        0,
        0,
        0,
        0,
        0,
        0,
        0,
        0,
        0,
        0,
        0,
        0,
        0,
        0,
        -0.1647472232580185,
        0,
        0,
        0,
        0,
        0,
        0,
        0,
        0,
        0,
        0,
        0,
        0,
        0,
        0,
        0.5354284644126892,
        0,
        0,
        0,
        0,
        0,
        0,
        0,
        0,
        0,
        0,
        0,
        0,
        0,
        0,
        0,
        0,
        0,
        0,
        0,
        0,
        0,
        0,
        0,
        0,
        0,
        0.1647472232580185,
        0,
        0,
        0,
        0,
        0,
        0,
        0,
        0.14415381848812103,
        0,
        0,
        0,
        0,
        0,
        0,
        0,
        0,
        0,
        0,
        0,
        0,
        0,
        0,
        0,
        0,
        0,
        0,
        0,
        0.20593403279781342,
        0,
        0,
        0,
        0,
        0,
        0,
        0,
        0,
        0,
        0,
        0,
        0,
        0,
        0,
        0,
        0,
        0,
        0,
        0,
        0,
        -0.24712082743644714,
        0,
        0,
        0,
        0,
        0,
        0,
        0,
        0,
        0,
        0,
        0,
        0,
        0,
        0,
        0,
        0,
        0,
        0,
        0,
        0,
        0,
        0,
        0,
        0,
        0,
        0,
        0,
        -0.18534061312675476,
        0,
        0,
        0,
        0,
        0,
        0,
        0,
        0,
        0,
        0,
        0,
        0,
        0,
        0,
        0.1647472232580185,
        0,
        0,
        0,
        0,
        -0.20593403279781342,
        0,
        -0.4324614405632019,
        0,
        0,
        0,
        0,
        0,
        0,
        0,
        0,
        0,
        0,
        0,
        0,
        0,
        0,
        0,
        0,
        0,
        0,
        0,
        0,
        0,
        0,
        0,
        0,
        0,
        0,
        0,
        0,
        0.2677142322063446,
        0,
        0,
        -0.24712082743644714,
        0,
        0,
        0,
        0,
        0.1647472232580185,
        0,
        0,
        0,
        0,
        0,
        0
      ]
    },
    {
      "id": "syntax.workshop",
      "spec_version": "0.3",
      "tags": [
        "syntax",
        "workshop",
        "capabilities"
      ],
      "keywords": [
        "workshop",
        "allow_net",
        "allow_write",
        "bind"
      ],
      "expansion": "`workshop` block: `allow_net`, `allow_write`, `bind <prefix>` lines, closed with `end`. Binds gate extern keys at check and run.",
      "tool_policy": [],
      "examples_ref": [
        "examples/workshop_read.imol"
      ],
      "embedding": [
        0,
        0,
        0,
        0,
        0,
        0,
        0,
        0,
        0,
        0,
        0,
        0,
        -0.5143707394599915,
        0,
        0,
        0,
        0,
        0,
        -0.15586993098258972,
        0,
        0,
        0,
        0,
        0,
        0,
        0,
        0,
        0,
        0,
        0,
        0,
        0,
        0,
        0,
        0,
        0,
        0,
        0,
        0,
        0,
        0,
        0,
        0,
        0,
        0,
        0,
        -0.2182178944349289,
        0,
        0,
        0,
        0,
        0,
        0,
        0,
        0,
        0,
        0,
        0,
        0,
        0,
        -0.17145690321922302,
        0,
        0,
        0,
        0,
        0,
        0,
        0,
        0,
        0,
        0,
        0.10910894721746445,
        0,
        0,
        -0.3740878105163574,
        0,
        0,
        0,
        0,
        0,
        0,
        0,
        0,
        0,
        0,
        0,
        0,
        0,
        0,
        0,
        0,
        0,
        0,
        0,
        0,
        0,
        0,
        0,
        -0.10910894721746445,
        0,
        0,
        0,
        0,
        0.1870439052581787,
        0,
        0.10910894721746445,
        0,
        0,
        0,
        0,
        0,
        0,
        0,
        0,
        0,
        0,
        0,
        0,
        0,
        0,
        0,
        0,
        0,
        0,
        0,
        0,
        0,
        0,
        0,
        0,
        0,
        0,
        0,
        0,
        0,
        0,
        -0.15586993098258972,
        0,
        0,
        0,
        0,
        0,
        0,
        0,
        0,
        0,
        0,
        0,
        0,
        0,
        0,
        0,
        0,
        0,